,Id,Title,Overview,Release_Date,Popularity,Vote_Average,Vote_Count
0,19404,Dilwale Dulhania Le Jayenge,"Raj is a rich, carefree, happy-go-lucky second generation NRI. Simran is the daughter of Chaudhary Baldev Singh, who in spite of being an NRI is very strict about adherence to Indian values. Simran has left for India to be married to her childhood fiancé. Raj leaves for India with a mission at his hands, to claim his lady love under the noses of her whole family. Thus begins a saga.",1995-10-20,15.135,8.9,2096
1,278,The Shawshank Redemption,"Framed in the 1940s for the double murder of his wife and her lover, upstanding banker Andy Dufresne begins a new life at the Shawshank prison, where he puts his accounting skills to work for an amoral warden. During his long stretch in prison, Dufresne comes to be admired by the other inmates -- including an older prisoner named Red -- for his integrity and unquenchable sense of hope.",1994-09-23,34.838,8.7,13626
2,496243,Parasite,"All unemployed, Ki-taek's family takes peculiar interest in the wealthy and glamorous Parks for their livelihood until they get entangled in an unexpected incident.",2019-10-11,49.485,8.7,520
3,238,The Godfather,"Spanning the years 1945 to 1955, a chronicle of the fictional Italian-American Corleone crime family. When organized crime family patriarch, Vito Corleone barely survives an attempt on his life, his youngest son, Michael steps in to take care of the would-be killers, launching a campaign of bloody revenge.",1972-03-15,29.942,8.6,10427
4,372058,Your Name.,"High schoolers Mitsuha and Taki are complete strangers living separate lives. But one night, they suddenly switch places. Mitsuha wakes up in Taki’s body, and he in hers. This bizarre occurrence continues to happen randomly, and the two must adjust their lives around each other.",2017-04-07,29.837,8.6,4418
5,424,Schindler's List,The true story of how businessman Oskar Schindler saved over a thousand Jewish lives from the Nazis while they worked as slaves in his factory during World War II.,1993-12-15,27.2,8.5,8378
6,240,The Godfather: Part II,"In the continuing saga of the Corleone crime family, a young Vito Corleone grows up in Sicily and in 1910s New York. In the 1950s, Michael Corleone attempts to expand the family business into Las Vegas, Hollywood and Cuba.",1974-12-20,25.762,8.5,6132
7,129,Spirited Away,"A young girl, Chihiro, becomes trapped in a strange new world of spirits. When her parents undergo a mysterious transformation, she must call upon the courage she never knew she had to free her family.",2002-09-20,37.41,8.5,7720
8,497,The Green Mile,"A supernatural tale set on death row in a Southern prison, where gentle giant John Coffey possesses the mysterious power to heal people's ailments. When the cell block's head guard, Paul Edgecomb, recognizes Coffey's miraculous gift, he tries desperately to help stave off the condemned man's execution.",1999-12-10,25.422,8.5,8648
9,637,Life Is Beautiful,A touching story of an Italian book seller of Jewish ancestry who lives in his own little fairy tale. His creative and happy life would come to an abrupt halt when his entire family is deported to a concentration camp during World War II. While locked up he tries to convince his son that the whole thing is just a game.,1998-10-22,17.503,8.5,7520
10,680,Pulp Fiction,"A burger-loving hit man, his philosophical partner, a drug-addled gangster's moll and a washed-up boxer converge in this sprawling, comedic crime caper. Their adventures unfurl in three stories that ingeniously trip back and forth in time.",1994-10-14,32.474,8.5,15858
11,324857,Spider-Man: Into the Spider-Verse,"Miles Morales is juggling his life between being a high school student and being a spider-man. When Wilson ""Kingpin"" Fisk uses a super collider, others from across the Spider-Verse are transported to this dimension.",2018-12-14,55.286,8.4,4825
12,155,The Dark Knight,"Batman raises the stakes in his war on crime. With the help of Lt. Jim Gordon and District Attorney Harvey Dent, Batman sets out to dismantle the remaining criminal organizations that plague the streets. The partnership proves to be effective, but they soon find themselves prey to a reign of chaos unleashed by a rising criminal mastermind known to the terrified citizens of Gotham as the Joker.",2008-07-18,35.042,8.4,19461
13,13,Forrest Gump,"A man with a low IQ has accomplished great things in his life and been present during significant historic events—in each case, far exceeding what anyone imagined he could do. But despite all he has achieved, his one true love eludes him.",1994-07-06,31.478,8.4,15481
14,550,Fight Club,"A ticking-time-bomb insomniac and a slippery soap salesman channel primal male aggression into a shocking new form of therapy. Their concept catches on, with underground ""fight clubs"" forming in every town, until an eccentric gets in the way and ignites an out-of-control spiral toward oblivion.",1999-10-15,30.497,8.4,16853
15,122,The Lord of the Rings: The Return of the King,"Aragorn is revealed as the heir to the ancient kings as he, Gandalf and the other members of the broken fellowship struggle to save Gondor from Sauron's forces. Meanwhile, Frodo and Sam bring the ring closer to the heart of Mordor, the dark lord's realm.",2003-12-17,34.646,8.4,13628
16,539,Psycho,"When larcenous real estate clerk Marion Crane goes on the lam with a wad of cash and hopes of starting a new life, she ends up at the notorious Bates Motel, where manager Norman Bates cares for his housebound mother. The place seems quirky, but fine… until Marion decides to take a shower.",1960-09-08,19.211,8.4,5180
17,14537,Harakiri,"Aging samurai Hanshiro Tsugumo arrives at the home of Kageyu Saito and asks to commit a ritual suicide on the property, which Saito thinks is a ploy to gain pity and a job. Saito tells Tsugumo of another samurai, Motome Chijiiwa, who threatened suicide as a stratagem, only to be forced to follow through on the task. When Tsugumo reveals that Chijiiwa was his son-in-law, the disclosure sets off a fierce conflict.",1963-09-11,12.331,8.4,269
18,429,"The Good, the Bad and the Ugly","While the Civil War rages between the Union and the Confederacy, three men – a quiet loner, a ruthless hit man and a Mexican bandit – comb the American Southwest in search of a strongbox containing $200,000 in stolen gold.",1967-12-29,26.548,8.4,4208
19,389,12 Angry Men,"The defense and the prosecution have rested and the jury is filing into the jury room to decide if a young Spanish-American is guilty or innocent of murdering his father. What begins as an open and shut case soon becomes a mini-drama of each of the jurors' prejudices and preconceptions about the trial, the accused, and each other.",1957-04-10,14.797,8.4,3908
20,311,Once Upon a Time in America,"A former Prohibition-era Jewish gangster returns to the Lower East Side of Manhattan over thirty years later, where he once again must confront the ghosts and regrets of his old life.",1984-06-01,17.159,8.4,2337
21,769,GoodFellas,"The true story of Henry Hill, a half-Irish, half-Sicilian Brooklyn kid who is adopted by neighbourhood gangsters at an early age and climbs the ranks of a Mafia family under the guidance of Jimmy Conway.",1990-09-19,22.719,8.4,5869
22,11216,Cinema Paradiso,"A filmmaker recalls his childhood, when he fell in love with the movies at his village's theater and formed a deep friendship with the theater's projectionist.",2002-06-14,14.023,8.4,1824
23,510,One Flew Over the Cuckoo's Nest,"While serving time for insanity at a state mental hospital, implacable rabble-rouser, Randle Patrick McMurphy, inspires his fellow patients to rebel against the authoritarian rule of head nurse, Mildred Ratched.",1975-11-18,22.362,8.4,5689
24,346,Seven Samurai,"A samurai answers a village's request for protection after he falls on hard times. The town needs protection from bandits, so the samurai gathers six others to help him teach the people how to defend themselves, and the villagers provide the soldiers with food. A giant battle occurs when 40 bandits attack the village.",1956-11-19,19.511,8.4,1545
25,40096,A Dog's Will,"The lively João Grilo and the sly Chicó are poor guys living in the hinterland who cheat a bunch of people in a small Northeast Brazil town. But when they die, they have to be judged by Christ, the Devil and the Virgin Mary, before they are admitted to paradise.",2000-09-15,10.682,8.4,475
26,901,City Lights,City Lights is the first silent film that Charlie Chaplin directed after he established himself with sound accompanied films. The film is about a penniless man who falls in love with a flower girl.,1931-03-07,11.758,8.4,900
27,12477,Grave of the Fireflies,"In the final months of World War II, 14-year-old Seita and his sister Setsuko are orphaned when their mother is killed during an air raid in Kobe, Japan. After a falling out with their aunt, they move into an abandoned bomb shelter. With no surviving relatives and their emergency rations depleted, Seita and Setsuko struggle to survive.",2019-01-01,0.6,8.4,2119
28,244786,Whiplash,"Under the direction of a ruthless instructor, a talented young drummer begins to pursue perfection at any cost, even his humanity.",2014-10-10,31.144,8.4,8183
29,598,City of God,"Cidade de Deus is a shantytown that started during the 1960s and became one of Rio de Janeiro’s most dangerous places in the beginning of the 1980s. To tell the story of this place, the movie describes the life of various characters, all seen by the point of view of the narrator, Buscapé. Buscapé was raised in a very violent environment. Despite the feeling that all odds were against him, he finds out that life can be seen with other eyes...",2002-08-31,16.717,8.4,3490
30,599,Sunset Boulevard,A hack screenwriter writes a screenplay for a former silent film star who has faded into Hollywood obscurity.,1950-08-10,17.636,8.4,1092
31,432517,Sherlock: The Final Problem,Long buried secrets finally come to light as someone has been playing a very long game indeed. Sherlock and John face their greatest ever challenge. Is the game finally over?,2017-01-15,9.655,8.4,707
32,18491,Neon Genesis Evangelion: The End of Evangelion,"The second of two theatrically released follow-ups to the Neon Genesis Evangelion series. Comprising of two alternate episodes which were first intended to take the place of episodes 25 and 26, this finale answers many of the questions surrounding the series, while also opening up some new possibilities.",1997-07-19,14.052,8.4,378
33,4935,Howl's Moving Castle,"When Sophie, a shy young woman, is cursed with an old body by a spiteful witch, her only chance of breaking the spell lies with a self-indulgent yet insecure young wizard and his companions in his legged, walking castle.",2005-06-10,23.896,8.4,4123
34,914,The Great Dictator,Dictator Adenoid Hynkel tries to expand his empire while a poor Jewish barber tries to avoid persecution from Hynkel's regime.,1940-10-15,15.861,8.4,1537
35,517814,Capernaum,"Zain, a 12-year-old boy scrambling to survive on the streets of Beirut, sues his parents for having brought him into such an unjust world, where being a refugee with no documents means that your rights can easily be denied.",2018-12-14,16.773,8.4,404
36,73,American History X,"Derek Vineyard is paroled after serving 3 years in prison for killing two thugs who tried to break into/steal his truck. Through his brother, Danny Vineyard's narration, we learn that before going to prison, Derek was a skinhead and the leader of a violent white supremacist gang that committed acts of racial crime throughout L.A. and his actions greatly influenced Danny. Reformed and fresh out of prison, Derek severs contact with the gang and becomes determined to keep Danny from going down the same violent path as he did.",1998-10-30,20.654,8.4,6141
37,299534,Avengers: Endgame,"After the devastating events of Avengers: Infinity War, the universe is in ruins due to the efforts of the Mad Titan, Thanos. With the help of remaining allies, the Avengers must assemble once more in order to undo Thanos' actions and restore order to the universe once and for all, no matter what consequences may be in store.",2019-04-26,129.157,8.4,8869
38,3782,Ikiru,"Mr. Watanabe suddenly finds that he has terminal cancer. He vows to make his final days meaningful. His attempts to communicate his anguish to his son and daughter-in-law lead only to heartbreak. Finally, inspired by an unselfish co-worker, he turns his efforts to bringing happiness to others by building a playground in a dreary slum neighborhood. When the park is finally completed, he is able to face death with peaceful acceptance.",1956-03-25,11.254,8.4,398
39,26451,Investigation of a Citizen Above Suspicion,"A chief of detectives, homicide section, kills his mistress and deliberately leaves clues to prove his own responsibility for the crime.",1970-12-20,10.419,8.4,244
40,1891,The Empire Strikes Back,"The epic saga continues as Luke Skywalker, in hopes of defeating the evil Galactic Empire, learns the ways of the Jedi from aging master Yoda. But Darth Vader is more determined than ever to capture Luke. Meanwhile, rebel leader Princess Leia, cocky Han Solo, Chewbacca, and droids C-3PO and R2-D2 are thrown into various stages of capture, betrayal and despair.",1980-05-21,23.038,8.4,10086
41,313106,Doctor Who: The Day of the Doctor,"In 2013, something terrible is awakening in London's National Gallery; in 1562, a murderous plot is afoot in Elizabethan England; and somewhere in space an ancient battle reaches its devastating conclusion. All of reality is at stake as the Doctor's own dangerous past comes back to haunt him.",2013-11-23,9.086,8.4,512
42,11659,The Best of Youth,"Spanning four decades, from the chaotic 1960s to the present, director Marco Tullio Giordana's passionate epic 'La Meglio Gioventu' follows two Italian brothers through some of the most tumultuous events of recent Italian history.",2003-08-30,5.414,8.3,218
43,128,Princess Mononoke,"Ashitaka, a prince of the disappearing Ainu tribe, is cursed by a demonized boar god and must journey to the west to find a cure. Along the way, he encounters San, a young human woman fighting to protect the forest, and Lady Eboshi, who is trying to destroy it. Ashitaka must find a way to bring balance to this conflict.",1999-10-29,23.229,8.3,3886
44,207,Dead Poets Society,"At an elite, old-fashioned boarding school in New England, a passionate English teacher inspires his students to rebel against convention and seize the potential of every day, courting the disdain of the stern headmaster.",1989-06-09,17.095,8.3,6071
45,20914,My Friends,"Like in many other Monicelli movies, the main theme of Amici miei is friendship, seen from a rather bitter point of view. It tells the story of four middle-aged friends in Florence who organize together idle pranks (called zingarate, ""gypsy shenanigans"") in a continuous attempt to prolong childhood during their adult life.",1975-08-15,7.6,8.3,313
46,265177,Mommy,"A peculiar neighbor offers hope to a recent widow who is struggling to raise a teenager who is unpredictable and, sometimes, violent.",2014-08-29,11.035,8.3,1463
47,10376,The Legend of 1900,"The story of a virtuoso piano player who lives his entire life aboard an ocean liner. Born and raised on the ship, 1900 (Tim Roth) learned about the outside world through interactions with passengers, never setting foot on land, even for the love of his life. Years later, the ship may be destroyed, and a former band member fears that 1900 may still be aboard, willing to go down with the ship.",1998-10-28,10.919,8.3,1164
48,290098,The Handmaiden,"1930s Korea, in the period of Japanese occupation, a young woman is hired as a handmaiden to a Japanese heiress who lives a secluded life on a large countryside estate with her domineering uncle. But, the maid has a secret: she is a pickpocket recruited by a swindler posing as a Japanese count to help him seduce the heiress to elope with him, rob her of her fortune, and lock her up in a madhouse. The plan seems to proceed according to plan until the women discover some unexpected emotions.",2016-10-21,19.448,8.3,1293
49,797,Persona,"A young nurse, Alma, is put in charge of Elisabeth Vogler: an actress who is seemingly healthy in all respects, but will not talk. As they spend time together, Alma speaks to Elisabeth constantly, never receiving any answer. Alma eventually confesses her secrets to a seemingly sympathetic Elisabeth and finds that her own personality is being submerged into Elisabeth's persona.",1967-03-06,14.028,8.3,766
50,895,Andrei Rublev,"An expansive Russian drama, this film focuses on the life of revered religious icon painter Andrei Rublev. Drifting from place to place in a tumultuous era, the peace-seeking monk eventually gains a reputation for his art. But after Rublev witnesses a brutal battle and unintentionally becomes involved, he takes a vow of silence and spends time away from his work. As he begins to ease his troubled soul, he takes steps towards becoming a painter once again.",1966-12-16,8.644,8.3,283
51,567,Rear Window,"Professional photographer L.B. ""Jeff"" Jeffries breaks his leg while getting an action shot at an auto race. Confined to his New York apartment, he spends his time looking out of the rear window observing the neighbors. He begins to suspect that a man across the courtyard may have murdered his wife. Jeff enlists the help of his high society fashion-consultant girlfriend Lisa Freemont and his visiting nurse Stella to investigate.",1954-08-04,15.467,8.3,3023
52,975,Paths of Glory,"During World War I, commanding officer General Broulard orders his subordinate, General Mireau, to attack a German trench position, offering a promotion as an incentive. Though the mission is foolhardy to the point of suicide, Mireau commands his own subordinate, Colonel Dax, to plan the attack. When it ends in disaster, General Mireau demands the court-martial of three random soldiers in order to save face.",1957-12-25,12.65,8.3,1228
53,452522,Twin Peaks,"An idiosyncratic FBI agent investigates the murder of a young woman in the even more idiosyncratic town of Twin Peaks. (This standalone version of the series pilot was produced for the European VHS market and has an alternate, closed ending.)",1989-12-31,7.453,8.3,302
54,18148,Tokyo Story,"The elderly Shukishi and his wife, Tomi, take the long journey from their small seaside village to visit their adult children in Tokyo. Their elder son, Koichi, a doctor, and their daughter, Shige, a hairdresser, don't have much time to spend with their aged parents, and so it falls to Noriko, the widow of their younger son who was killed in the war, to keep her in-laws company.",1972-03-13,11.716,8.3,365
55,423,The Pianist,"The true story of pianist Wladyslaw Szpilman's experiences in Warsaw during the Nazi occupation. When the Jews of the city find themselves forced into a ghetto, Szpilman finds work playing in a café; and when his family is deported in 1942, he stays behind, works for a while as a laborer, and eventually goes into hiding in the ruins of the war-torn city.",2002-12-04,17.345,8.3,4204
56,101,Léon: The Professional,"Léon, the top hit man in New York, has earned a rep as an effective ""cleaner"". But when his next-door neighbors are wiped out by a loose-cannon DEA agent, he becomes the unwilling custodian of 12-year-old Mathilda. Before long, Mathilda's thoughts turn to revenge, and she considers following in Léon's footsteps.",1994-11-18,31.783,8.3,8005
57,37257,Witness for the Prosecution,"When Leonard Vole is arrested for the sensational murder of a rich, middle-aged widow, the famous Sir Wilfrid Robarts agrees to appear on his behalf. Sir Wilfrid, recovering from a near-fatal heart attack, is supposed to be on a diet of bland, civil suits—but the lure of the criminal courts is too much for him, especially when the case is so difficult.",1957-12-17,15.411,8.3,526
58,24382,Big Deal on Madonna Street,"Best friends Peppe and Mario are thieves, but they're not very good at it. Still, Peppe thinks that he's finally devised a master heist that will make them rich. With the help of some fellow criminals, he plans to dig a tunnel from a rented apartment to the pawnshop next door, where they can rob the safe. But his plan is far from foolproof, and the fact that no one in the group has any experience digging tunnels proves to be the least of their problems.",1958-06-06,8.812,8.3,283
59,807,Se7en,"Two homicide detectives are on a desperate hunt for a serial killer whose crimes are based on the ""seven deadly sins"" in this dark and haunting film that takes viewers from the tortured remains of one victim to the next. The seasoned Det. Sommerset researches each sin in an effort to get inside the killer's mind, while his novice partner, Mills, scoffs at his efforts to unravel the case.",1995-09-22,38.79,8.3,11087
60,16672,Woman in the Dunes,An entomologist suffers extreme psychological and sexual torture after being taken captive by the residents of a poor seaside village.,1964-10-25,8.404,8.3,152
61,55960,"Toto, Peppino, and the Hussy","Antonio, Peppino and Lucia are three brothers who live in the country near Naples. Lucia's son, Gianni, goes to Naples to study medicine, but there he knows a ballet dancer. They fall in love and, when she goes to Milan, Gianni follows her. Informed of this and afraid that their nephew will stop studying, the three Caponi brothers leave for Milan to persuade Gianni to come back and continue studying and abandon the ""Malafemmina"" (bad girl).",1956-08-14,6.318,8.3,161
62,120,The Lord of the Rings: The Fellowship of the Ring,"Young hobbit Frodo Baggins, after inheriting a mysterious ring from his uncle Bilbo, must leave his home in order to keep it from falling into the hands of its evil creator. Along the way, a fellowship is formed to protect the ringbearer and make sure that the ring arrives at its final destination: Mt. Doom, the only place where it can be destroyed.",2001-12-19,41.125,8.3,14987
63,398818,Call Me by Your Name,"Elio Perlman is spending the summer with his family at their vacation home in Lombardy, Italy. When his father hires a handsome doctoral student, the curious 17-year-old finds himself developing a growing attraction to the young man.",2017-11-24,28.23,8.3,5291
64,490132,Green Book,"Tony Lip, a bouncer in 1962, is hired to drive pianist Don Shirley on a tour through the Deep South in the days when African Americans, forced to find alternate accommodations and services due to segregation laws below the Mason-Dixon Line, relied on a guide called The Negro Motorist Green Book.",2018-11-16,30.255,8.3,4058
65,24188,Il Sorpasso,"Roberto, a shy law student in Rome, meets Bruno, a forty-year-old exuberant, capricious man, who takes him for a drive through the Roman and Tuscany countries in the summer. Along the way, they end up knowing each other and entering each other's lives. A twist at the end puts everything into perspective.",1962-12-04,7.502,8.3,246
66,27205,Inception,"Cobb, a skilled thief who commits corporate espionage by infiltrating the subconscious of his targets is offered a chance to regain his old life as payment for a task considered to be impossible: ""inception"", the implantation of another person's idea into a target's subconscious.",2010-07-16,45.147,8.3,22879
67,3082,Modern Times,The Tramp struggles to live in modern industrial society with the help of a young homeless woman.,1936-02-05,14.167,8.3,1814
68,274,The Silence of the Lambs,"Clarice Starling is a top student at the FBI's training academy. Jack Crawford wants Clarice to interview Dr. Hannibal Lecter, a brilliant psychiatrist who is also a violent psychopath, serving life behind bars for various acts of murder and cannibalism. Crawford believes that Lecter may have insight into a case and that Starling, as an attractive young woman, may be just the bait to draw him out.",1991-02-01,5.31,8.3,8787
69,299536,Avengers: Infinity War,"As the Avengers and their allies have continued to protect the world from threats too large for any one hero to handle, a new danger has emerged from the cosmic shadows: Thanos. A despot of intergalactic infamy, his goal is to collect all six Infinity Stones, artifacts of unimaginable power, and use them to inflict his twisted will on all of reality. Everything the Avengers have fought for has led up to this moment - the fate of Earth and existence itself has never been more uncertain.",2018-04-27,80.218,8.3,14935
70,121,The Lord of the Rings: The Two Towers,"Frodo and Sam are trekking to Mordor to destroy the One Ring of Power while Gimli, Legolas and Aragorn search for the orc-captured Merry and Pippin. All along, nefarious wizard Saruman awaits the Fellowship members at the Orthanc Tower in Isengard.",2002-12-18,29.31,8.3,12917
71,378064,A Silent Voice,"Shouya Ishida starts bullying the new girl in class, Shouko Nishimiya, because she is deaf. But as the teasing continues, the rest of the class starts to turn on Shouya for his lack of compassion. When they leave elementary school, Shouko and Shouya do not speak to each other again... until an older, wiser Shouya, tormented by his past behaviour, decides he must see Shouko once more. He wants to atone for his sins, but is it already too late...?",2017-10-20,15.065,8.3,1149
72,12493,High and Low,An executive of a shoe company becomes a victim of extortion when his chauffeur's son is kidnapped and held for ransom.,1963-11-26,10.62,8.3,231
