,Id,Title,Overview,Release_Date,Popularity,Vote_Average,Vote_Count
73,25237,Come and See,"The invasion of a village in Byelorussia by German forces sends young Florya into the forest to join the weary Resistance fighters, against his family's wishes. There he meets a girl, Glasha, who accompanies him back to his village. On returning home, Florya finds his family and fellow peasants massacred. His continued survival amidst the brutal debris of war becomes increasingly nightmarish, a battle between despair and hope.",1985-12-06,10.931,8.3,349
74,335,Once Upon a Time in the West,A widow whose land and life are in danger as the railroad is getting closer and closer to taking them over. A mysterious harmonica player joins forces with a desperado to protect the woman and her land.,1969-05-28,22.671,8.3,2123
75,455661,In a Heartbeat,A closeted boy runs the risk of being outed by his own heart after it pops out of his chest to chase down the boy of his dreams.,2017-06-01,6.032,8.3,715
76,1398,Stalker,"Near a gray and unnamed city is the Zone, a place guarded by barbed wire and soldiers, and where the normal laws of physics are victim to frequent anomalies. A stalker guides two men into the Zone, specifically to an area in which deep-seated desires are granted.",1979-08-01,17.383,8.3,771
77,157336,Interstellar,Interstellar chronicles the adventures of a group of explorers who make use of a newly discovered wormhole to surpass the limitations on human space travel and conquer the vast distances involved in an interstellar voyage.,2014-11-05,47.87,8.2,19250
78,538362,On My Skin,"The incredible true story behind the most controversial Italian court cases in recent years. Stefano Cucchi was arrested for a minor crime and mysteriously found dead during his detention. In one week's time, a family is changed forever.",2018-09-12,10.726,8.2,1123
79,77338,The Intouchables,A true story of two men who should never have met – a quadriplegic aristocrat who was injured in a paragliding accident and a young man from the projects.,2011-11-02,13.312,8.2,10252
80,10098,The Kid,"Considered one of Charlie Chaplin's best films, The Kid also made a star of little Jackie Coogan, who plays a boy cared for by The Tramp after he's abandoned, as a newborn, by his mother. The mother later has a change of heart and aches to be reunited with her son.",1921-02-06,11.18,8.2,861
81,8587,The Lion King,A young lion cub named Simba can't wait to be king. But his uncle craves the title for himself and will stop at nothing to get it.,1994-06-23,36.569,8.2,10706
82,105,Back to the Future,"Eighties teenager Marty McFly is accidentally sent back in time to 1955, inadvertently disrupting his parents' first meeting and attracting his mother's romantic interest. Marty must repair the damage to history by rekindling his parents' romance and - with the help of his eccentric inventor friend Doc Brown - return to 1985.",1985-07-03,24.751,8.2,11392
83,339877,Loving Vincent,"The film brings the paintings of Vincent van Gogh to life to tell his remarkable story. Every one of the 65,000 frames of the film is an oil-painting hand-painted by 125 professional oil-painters who travelled from all across the world to the Loving Vincent studios in Poland and Greece to be a part of the production. As remarkable as Vincent’s brilliant paintings are his passionate and ill-fated life and mysterious death.",2017-09-22,10.403,8.2,1265
84,406997,Wonder,"The story of August Pullman – a boy with facial differences – who enters fifth grade, attending a mainstream elementary school for the first time.",2017-11-17,21.058,8.2,4166
85,284,The Apartment,"Bud Baxter is a minor clerk in a huge New York insurance company, until he discovers a quick way to climb the corporate ladder. He lends out his apartment to the executives as a place to take their mistresses. Although he often has to deal with the aftermath of their visits, one night he's left with a major problem to solve.",1960-06-15,14.233,8.2,950
86,28,Apocalypse Now,"At the height of the Vietnam war, Captain Benjamin Willard is sent on a dangerous mission that, officially, ""does not exist, nor will it ever exist."" His goal is to locate - and eliminate - a mysterious Green Beret Colonel named Walter Kurtz, who has been leading his personal army on illegal guerrilla missions into enemy territory.",1979-08-15,24.382,8.2,4077
87,5156,Bicycle Thieves,"Antonio, an unemployed man in the depressed post-WWII economy of Italy, at last finds a good job hanging up posters, the only requirement for which is that he must have his own bicycle. When Antonio’s bicycle is stolen, he and his son are forced to walk the streets of Rome in search of it, or else face ruin.",1949-12-12,13.208,8.2,947
88,426,Vertigo,"A retired San Francisco detective suffering from acrophobia investigates the strange activities of an old friend's wife, all the while becoming dangerously obsessed with her.",1958-05-09,15.67,8.2,2613
89,470044,The Hate U Give,"Raised in a poverty-stricken slum, a 16-year-old girl named Starr now attends a suburban prep school. After she witnesses a police officer shoot her unarmed best friend, she's torn between her two very different worlds as she tries to speak her truth.",2018-10-19,17.295,8.2,742
90,670,Oldboy,"With no clue how he came to be imprisoned, drugged and tortured for 15 years, a desperate businessman seeks revenge on his captors.",2003-11-21,16.516,8.2,3896
91,1585,It's a Wonderful Life,"A holiday favourite for generations...  George Bailey has spent his entire life giving to the people of Bedford Falls.  All that prevents rich skinflint Mr. Potter from taking over the entire town is George's modest building and loan company.  But on Christmas Eve the business's $8,000 is lost and George's troubles begin.",1947-01-07,14.97,8.2,2072
92,422,8½,"Guido Anselmi, a film director, finds himself creatively barren at the peak of his career. Urged by his doctors to rest, Anselmi heads for a luxurious resort, but a sorry group gathers—his producer, staff, actors, wife, mistress, and relatives—each one begging him to get on with the show. In retreat from their dependency, he fantasizes about past women and dreams of his childhood.",1963-06-24,15.537,8.2,906
93,629,The Usual Suspects,"Held in an L.A. interrogation room, Verbal Kint attempts to convince the feds that a mythic crime lord, Keyser Soze, not only exists, but was also responsible for drawing him and his four partners into a multi-million dollar heist that ended with an explosion in San Pedro harbor – leaving few survivors. Verbal lures his interrogators with an incredible story of the crime lord's almost supernatural prowess.",1995-08-16,16.263,8.2,5819
94,411088,The Invisible Guest,"A young businessman wakes up in a hotel room, locked from the inside, along with his lover, who was murdered while he was unconscious. He hires a prestigious lawyer, and over the course of one evening, they must work together to build a defense case for him before he is taken to jail.",2016-09-22,27.17,8.2,1798
95,992,"Sherlock, Jr.","A film projectionist longs to be a detective, and puts his meagre skills to work when he is framed by a rival for stealing his girlfriend's father's pocketwatch.",1924-04-21,7.486,8.2,316
96,490,The Seventh Seal,"When disillusioned Swedish knight Antonius Block returns home from the Crusades to find his country in the grips of the Black Death, he challenges Death to a chess match for his life. Tormented by the belief that God does not exist, Block sets off on a journey, meeting up with traveling players Jof and his wife, Mia, and becoming determined to evade Death long enough to commit one redemptive act while he still lives.",1958-10-13,14.065,8.2,1216
97,38288,I Corti,"The shorts of Aldo , Giovanni &amp; Giacomo was the first theatrical show of the trio of comedians Aldo , Giovanni &amp; Giacomo , with the participation of Marina Massironi .  The show is the son of the fortunate trio 's holdings in television as Mai dire Gol, and shows such as The Circus by Paolo Rossi and on the head !  The short was recorded live at the Teatro Nuovo in Ferrara on 28 and 29 March 1996. Produced by Agidi , the theater director is entrusted to the change artist Arturo Brachetti .",1996-01-01,7.306,8.2,240
98,19,Metropolis,"In a futuristic city sharply divided between the working class and the city planners, the son of the city's mastermind falls in love with a working class prophet who predicts the coming of a savior to mediate their differences.",2010-04-25,15.971,8.2,1214
99,110420,Wolf Children,"After her werewolf lover unexpectedly dies in an accident, a woman must find a way to raise the son and daughter that she had with him. However, their inheritance of their father's traits prove to be a challenge for her.",2013-11-26,11.732,8.2,1108
100,705,All About Eve,"From the moment she glimpses her idol at the stage door, Eve Harrington is determined to take the reins of power away from the great actress Margo Channing. Eve maneuvers her way into Margo's Broadway role, becomes a sensation and even causes turmoil in the lives of Margo's director boyfriend, her playwright and his wife. Only the cynical drama critic sees through Eve, admiring her audacity and perfect pattern of deceit.",2000-10-06,16.381,8.2,705
101,694,The Shining,"Jack Torrance accepts a caretaker job at the Overlook Hotel, where he, along with his wife Wendy and their son Danny, must live isolated from the rest of the world for the winter. But they aren't prepared for the madness that lurks within.",1980-05-23,24.109,8.2,8919
102,77,Memento,"Leonard Shelby is tracking down the man who raped and murdered his wife. The difficulty of locating his wife's killer, however, is compounded by the fact that he suffers from a rare, untreatable form of short-term memory loss. Although he can recall details of life before his accident, Leonard cannot remember what happened fifteen minutes ago, where he's going, or why.",2001-03-16,18.477,8.2,8115
103,429210,Bingo: The King of the Mornings,"1980s. Brazilian television exploding in color and auditorium programs not so politically correct. In the middle of this fervor, Augusto Mendes, a young rising actor, seeks his place in the sun. From porn studios to soap operas, he finally finds success and fame when he becomes ""Bingo"", a TV host clown from one of the audience leader TV shows for children. It turns out that behind the rice powder and red nose, nobody knows who he is.",2017-08-24,5.495,8.2,193
104,11,Star Wars,Princess Leia is captured and held hostage by the evil Imperial forces in their effort to take over the galactic Empire. Venturesome Luke Skywalker and dashing captain Han Solo team together with the loveable robot duo R2-D2 and C-3PO to rescue the beautiful princess and restore peace and justice in the Empire.,1977-05-25,46.214,8.2,11810
105,282848,Doctor Who: The Time of the Doctor,"Orbiting a quiet backwater planet, the massed forces of the universe's deadliest species gather, drawn to a mysterious message that echoes out to the stars. And amongst them, the Doctor. Rescuing Clara from a family Christmas dinner, the Time Lord and his best friend must learn what this enigmatic signal means for his own fate and that of the universe.",2013-12-25,6.486,8.2,184
106,185,A Clockwork Orange,"Demonic gang-leader Alex goes on the spree of rape, mugging and murder with his pack of ""droogs"". But he's a boy who also likes Beethoven's Ninth and a bit of ""the old in-out, in-out"". He later finds himself at the mercy of the state and its brainwashing experiment designed to take violence off the streets.",1971-12-18,25.281,8.2,6985
107,996,Double Indemnity,"A rich woman and a calculating insurance agent plot to kill her unsuspecting husband after he signs a double indemnity policy.  Against a backdrop of distinctly Californian settings, the partners in crime plan the perfect murder to collect the insurance, which pays  double if the death is accidental.",1944-04-24,16.654,8.2,781
108,239,Some Like It Hot,"Two musicians witness a mob hit and struggle to find a way out of the city before they are found by the gangsters. Their only opportunity is to join an all-girl band as they leave on a tour. To make their getaway they must first disguise themselves as women, then keep their identities secret and deal with the problems this brings - such as an attractive bandmate and a very determined suitor.",1959-03-18,16.208,8.2,1620
109,548,Rashomon,"Brimming with action while incisively examining the nature of truth, ""Rashomon"" is perhaps the finest film ever to investigate the philosophy of justice. Through an ingenious use of camera and flashbacks, Kurosawa reveals the complexities of human nature as four people recount different versions of the story of a man's murder and the rape of his wife.",1950-12-26,13.289,8.2,882
110,19542,The Red Shoes,"In this classic drama, Vicky Page is an aspiring ballerina torn between her dedication to dance and her desire to love. While her imperious instructor, Boris Lermontov, urges to her to forget anything but ballet, Vicky begins to fall for the charming young composer Julian Craster. Eventually Vicky, under great emotional stress, must choose to pursue either her art or her romance, a decision that carries serious consequences.",1948-09-06,9.213,8.2,228
111,92321,Hotarubi no Mori e,"One hot summer day a little girl gets lost in an enchanted forest of the mountain god where spirits reside. A young boy appears before her, but she cannot touch him for fear of making him disappear. And so a wondrous adventure awaits...",2012-06-30,0.6,8.2,295
112,399106,Piper,"A mother bird tries to teach her little one how to find food by herself. In the process, she encounters a traumatic experience that she must overcome in order to survive.",2016-06-17,7.501,8.2,886
113,28422,Love Exposure,"The story of a teenage boy named Yu, who falls for Yoko, a girl he runs into while working as an `up-skirt' photographer in an offshoot of the porn industry. His attempts to woo her are complicated by a spot of cross-dressing - which convinces Yoko that she is lesbian - dalliances with kung-fu and crime, and a constant struggle with the guilt that's a legacy of his Catholic upbringing.",2008-11-29,7.332,8.2,177
114,10494,Perfect Blue,A retired pop singer turned actress' sense of reality is shaken when she is stalked by an obsessed fan and seemingly a ghost of her past.,1999-08-20,14.154,8.2,721
115,9764,Dersu Uzala,"A military explorer meets and befriends a Goldi man in Russia’s unmapped forests. A deep and abiding bond evolves between the two men, one civilized in the usual sense, the other at home in the glacial Siberian woods.",1977-12-20,7.754,8.2,170
116,354912,Coco,"Despite his family’s baffling generations-old ban on music, Miguel dreams of becoming an accomplished musician like his idol, Ernesto de la Cruz. Desperate to prove his talent, Miguel finds himself in the stunning and colorful Land of the Dead following a mysterious chain of events. Along the way, he meets charming trickster Hector, and together, they set off on an extraordinary journey to unlock the real story behind Miguel's family history.",2017-11-22,35.79,8.2,9109
117,103,Taxi Driver,"A mentally unstable Vietnam War veteran works as a night-time taxi driver in New York City where the perceived decadence and sleaze feeds his urge for violent action, attempting to save a preadolescent prostitute in the process.",1976-02-08,24.912,8.2,5491
118,527641,Five Feet Apart,"Seventeen-year-old Stella spends most of her time in the hospital as a cystic fibrosis patient. Her life is full of routines, boundaries and self-control -- all of which get put to the test when she meets Will, an impossibly charming teen who has the same illness. There's an instant flirtation, though restrictions dictate that they must maintain a safe distance between them. As their connection intensifies, so does the temptation to throw the rules out the window and embrace that attraction.",2019-03-15,26.3,8.2,1237
119,505262,My Hero Academia: Two Heroes,"All Might and Deku accept an invitation to go abroad to a floating and mobile manmade city, called 'I Island', where they research quirks as well as hero supplemental items at the special 'I Expo' convention that is currently being held on the island. During that time, suddenly, despite an iron wall of security surrounding the island, the system is breached by a villain, and the only ones able to stop him are the students of Class 1-A.",2018-09-25,12.902,8.1,176
120,780,The Passion of Joan of Arc,"A classic of the silent age, this film tells the story of the doomed but ultimately canonized 15th-century teenage warrior. On trial for claiming she'd spoken to God, Jeanne d'Arc is subjected to inhumane treatment and scare tactics at the hands of church court officials. Initially bullied into changing her story, Jeanne eventually opts for what she sees as the truth. Her punishment, a famously brutal execution, earns her perpetual martyrdom.",1929-03-28,8.473,8.2,339
121,359940,"Three Billboards Outside Ebbing, Missouri","After seven months have passed without a culprit in her daughter's murder case, Mildred Hayes makes a bold move, painting three signs leading into her town with a controversial message directed at Bill Willoughby, the town's revered chief of police. When his second-in-command Officer Jason Dixon, an immature mother's boy with a penchant for violence, gets involved, the battle between Mildred and Ebbing's law enforcement is only exacerbated.",2017-11-10,19.504,8.2,5659
122,14696,Ugetsu,"In 16th century Japan, peasants Genjuro and Tobei sell their earthenware pots to a group of soldiers in a nearby village, in defiance of a local sage's warning against seeking to profit from warfare. Genjuro's pursuit of both riches and the mysterious Lady Wakasa, as well as Tobei's desire to become a samurai, run the risk of destroying both themselves and their wives, Miyagi and Ohama.",1954-09-07,9.978,8.2,189
123,334543,Lion,"A five-year-old Indian boy gets lost on the streets of Calcutta, thousands of kilometers from home. He survives many challenges before being adopted by a couple in Australia; 25 years later, he sets out to find his lost family.",2016-11-25,26.349,8.2,4003
124,1124,The Prestige,"A mysterious story of two magicians whose intense rivalry leads them on a life-long battle for supremacy -- full of obsession, deceit and jealousy with dangerous and deadly consequences.",2006-10-19,19.72,8.2,8475
125,500,Reservoir Dogs,"A botched robbery indicates a police informant, and the pressure mounts in the aftermath at a warehouse. Crime begets violence as the survivors -- veteran Mr. White, newcomer Mr. Orange, psychopathic parolee Mr. Blonde, bickering weasel Mr. Pink and Nice Guy Eddie -- unravel.",1992-10-23,23.459,8.2,7559
126,935,Dr. Strangelove or: How I Learned to Stop Worrying and Love the Bomb,"After the insane General Jack D. Ripper initiates a nuclear strike on the Soviet Union, a war room full of politicians, generals and a Russian diplomat all frantically try to stop the nuclear strike.",1964-01-29,15.62,8.1,2862
127,449176,"Love, Simon",Everyone deserves a great love story. But for seventeen-year old Simon Spier it's a little more complicated: he's yet to tell his family or friends he's gay and he doesn't know the identity of the anonymous classmate he's fallen for online.,2018-03-16,20.43,8.1,3390
128,11878,Yojimbo,"A nameless ronin, or samurai with no master, enters a small village in feudal Japan where two rival businessmen are struggling for control of the local gambling trade. Taking the name Sanjuro Kuwabatake, the ronin convinces both silk merchant Tazaemon and sake merchant Tokuemon to hire him as a personal bodyguard, then artfully sets in motion a full-scale gang war between the two ambitious and unscrupulous men.",1961-09-13,17.178,8.1,580
129,833,Umberto D.,"When elderly pensioner Umberto Domenico Ferrari returns to his boarding house from a protest calling for a hike in old-age pensions, his landlady demands her 15,000-lire rent by the end of the month or he and his small dog will be turned out onto the street. Unable to get the money in time, Umberto fakes illness to get sent to a hospital, giving his beloved dog to the landlady's pregnant and abandoned maid for temporary safekeeping.",1952-11-07,6.845,8.1,222
130,8392,My Neighbor Totoro,"Two sisters move to the country with their father in order to be closer to their hospitalized mother, and discover the surrounding trees are inhabited by Totoros, magical spirits of the forest. When the youngest runs away from home, the older sister seeks help from the spirits to find her.",2018-12-11,33.503,8.1,3418
131,28978,The Circus,"Charlie, a wandering tramp, becomes a circus handyman and falls in love with the circus owner's daughter. Unaware of Charlie's affection, the girl falls in love with a handsome young performer. Charlie's versatility makes him star of the show when he substitutes for an ailing tightwire walker. He is discharged from the company when he protects the girl from her father's abuse, but he returns and appeals to the handsome performer to marry the girl. After the wedding the father prevails upon them to rejoin the circus. Charlie is hired again, but he stays behind when the caravan moves on.",1928-01-06,8.65,8.1,282
132,872,Singin' in the Rain,"In 1927 Hollywood, a silent film production company and cast make a difficult transition to sound.",1952-04-10,14.771,8.1,1470
133,50014,The Help,"Aibileen Clark is a middle-aged African-American maid who has spent her life raising white children and has recently lost her only son; Minny Jackson is an African-American maid who has often offended her employers despite her family's struggles with money and her desperate need for jobs; and Eugenia ""Skeeter"" Phelan is a young white woman who has recently moved back home after graduating college to find out her childhood maid has mysteriously disappeared. These three stories intertwine to explain how life in Jackson, Mississippi revolves around ""the help""; yet they are always kept at a certain distance because of racial lines.",2011-08-10,11.42,8.1,4097
134,832,M,"In this classic German thriller, Hans Beckert, a serial killer who preys on children, becomes the focus of a massive Berlin police manhunt. Beckert's heinous crimes are so repellant and disruptive to city life that he is even targeted by others in the seedy underworld network. With both cops and criminals in pursuit, the murderer soon realizes that people are on his trail, sending him into a tense, panicked attempt to escape justice.",1933-05-14,12.796,8.1,904
135,654,On the Waterfront,"Terry Malloy dreams about being a prize fighter, while tending his pigeons and running errands at the docks for Johnny Friendly, the corrupt boss of the dockers union. Terry witnesses a murder by two of Johnny's thugs, and later meets the dead man's sister and feels responsible for his death. She introduces him to Father Barry, who tries to force him to provide information for the courts that will smash the dock racketeers.",1954-07-28,14.409,8.1,687
136,961,The General,"During America’s Civil War Union spies steal engineer Johnnie Gray's beloved locomotive The General - his lady love, Annabelle Lee, aboard an attached boxcar - and he single-handedly must do all in his power to both get The General back and to rescue Annabelle. Released throughout most of the world in 1927, this Silent comedy-action film flopped when originally released, but now is regarded as one of the great American motion pictures. The story is based on actual historic events.",1927-01-15,10.955,8.1,468
137,1396,Mirror,"A dying man in his forties recalls his childhood, his mother, the war and personal moments that tell of and juxtapose pivotal moments in Soviet history with daily life.",1975-11-11,11.237,8.1,328
138,16869,Inglourious Basterds,"In Nazi-occupied France during World War II, a group of Jewish-American soldiers known as ""The Basterds"" are chosen specifically to spread fear throughout the Third Reich by scalping and brutally killing Nazis. The Basterds, lead by Lt. Aldo Raine soon cross paths with a French-Jewish teenage girl who runs a movie theater in Paris which is targeted by the soldiers.",2009-08-21,30.019,8.1,12488
139,655,"Paris, Texas","A man wanders out of the desert not knowing who he is. His brother finds him, and helps to pull his memory back of the life he led before he walked out on his family and disappeared four years earlier.",1984-11-02,12.862,8.1,606
140,614,Wild Strawberries,"Crotchety retired doctor Isak Borg travels from Stockholm to Lund, Sweden, with his pregnant and unhappy daughter-in-law, Marianne, in order to receive an honorary degree from his alma mater. Along the way, they encounter a series of hitchhikers, each of whom causes the elderly doctor to muse upon the pleasures and failures of his own life. These include the vivacious young Sara, a dead ringer for the doctor's own first love.",1957-12-26,13.339,8.1,624
141,1422,The Departed,"To take down South Boston's Irish Mafia, the police send in one of their own to infiltrate the underworld, not realizing the syndicate has done likewise. While an undercover cop curries favor with the mob kingpin, a career criminal rises through the police ranks. But both sides soon discover there's a mole among them.",2006-10-05,20.152,8.1,8172
142,264644,Room,Jack is a young boy of 5 years old who has lived all his life in one room. He believes everything within it are the only real things in the world. But what will happen when his Ma suddenly tells him that there are other things outside of Room?,2015-10-16,16.824,8.1,5713
