,Id,Title,Overview,Release_Date,Popularity,Vote_Average,Vote_Count
143,437068,A Taxi Driver,"May, 1980. Man-seob is a taxi driver in Seoul who lives from hand to mouth, raising his young daughter alone. One day, he hears that there is a foreigner who will pay big money for a drive down to Gwangju city. Not knowing that he’s a German journalist with a hidden agenda, Man-seob takes the job.",2017-08-02,9.089,8.1,152
144,439,La Dolce Vita,Episodic journey of an Italian journalist scouring Rome in search of love.,1961-04-19,10.443,8.1,721
145,307,"Rome, Open City","ROME, OPEN CITY is a landmark in film history. Filmed in secrecy during the Nazi occupation of Italy, the film shows a realistic portrayal of the underground resistance in Italy in 1945. The film has strong impacting imagery with its mix of fiction and reality that strengthened Italian Neo-realism and the film industry.",1946-02-25,7.693,8.1,313
146,98,Gladiator,"In the year 180, the death of emperor Marcus Aurelius throws the Roman Empire into chaos.  Maximus is one of the Roman army's most capable and trusted generals and a key advisor to the emperor.  As Marcus' devious son Commodus ascends to the throne, Maximus is set to be executed.  He escapes, but is captured by slave traders.  Renamed Spaniard and forced to become a gladiator, Maximus must battle to the death with other men for the amusement of paying audiences.",2000-05-01,22.408,8.1,10050
147,110416,Song of the Sea,"The story of the last Seal Child’s journey home. After their mother’s disappearance, Ben and Saoirse are sent to live with Granny in the city. When they resolve to return to their home by the sea, their journey becomes a race against time as they are drawn into a world Ben knows only from his mother’s folktales. But this is no bedtime story; these fairy folk have been in our world far too long. It soon becomes clear to Ben that Saoirse is the key to their survival.",2014-12-19,11.456,8.1,725
148,111,Scarface,"After getting a green card in exchange for assassinating a Cuban government official, Tony Montana stakes a claim on the drug trade in Miami. Viciously murdering anyone who stands in his way, Tony eventually becomes the biggest drug lord in the state, controlling nearly all the cocaine that comes through Miami. But increased pressure from the police, wars with Colombian drug cartels and his own drug-fueled paranoia serve to fuel the flames of his eventual downfall.",1983-12-08,19.286,8.1,5660
149,149871,The Tale of the Princess Kaguya,"Found inside a shining stalk of bamboo by an old bamboo cutter and his wife, a tiny girl grows rapidly into an exquisite young lady. The mysterious young princess enthralls all who encounter her - but ultimately she must confront her fate, the punishment for her crime.",2014-10-17,10.645,8.1,688
150,147,The 400 Blows,"For young Parisian boy Antoine Doinel, life is one difficult situation after another. Surrounded by inconsiderate adults, including his neglectful parents, Antoine spends his days with his best friend, Rene, trying to plan for a better life. When one of their schemes goes awry, Antoine ends up in trouble with the law, leading to even more conflicts with unsympathetic authority figures.",1959-05-04,12.653,8.1,811
151,360814,Dangal,"Dangal is an extraordinary true story based on the life of Mahavir Singh and his two daughters, Geeta and Babita Phogat. The film traces the inspirational journey of a father who trains his daughters to become world class wrestlers.",2016-12-21,13.288,8.1,375
152,2517,Nobody Knows,"In a small Tokyo apartment, twelve-year-old Akira must care for his younger siblings after their mother leaves them and shows no sign of returning.",2004-08-07,8.168,8.1,173
153,289,Casablanca,"In Casablanca, Morocco in December 1941, a cynical American expatriate meets a former lover, with unforeseen complications.",1942-11-26,16.111,8.1,2619
154,3090,The Treasure of the Sierra Madre,"Fred C. Dobbs and Bob Curtin, both down on their luck in Tampico, Mexico in 1925, meet up with a grizzled prospector named Howard and decide to join with him in search of gold in the wilds of central Mexico. Through enormous difficulties, they eventually succeed in finding gold, but bandits, the elements, and most especially greed threaten to turn their success into disaster.",1948-01-24,14.593,8.1,507
155,237791,The Way He Looks,"Leonardo is a blind teenager dealing with an overprotective mother while trying to live a more independent life. To the disappointment of his best friend, Giovana, he plans to go on an exchange program abroad. When Gabriel, a new student in town, arrives at their classroom, new feelings blossom in Leonardo making him question his plans.",2014-11-07,6.493,8.1,591
156,29264,The Exterminating Angel,"After a lavish dinner party, the guests find themselves mysteriously unable to leave the room.",1963-09-10,6.276,8.1,252
157,10242,What Ever Happened to Baby Jane?,"Two aging film actresses live as virtual recluses in an old Hollywood mansion. Jane Hudson, a successful child star, cares for her crippled sister Blanche, whose career in later years eclipsed that of Jane. Now the two live together, their relationship affected by simmering subconscious thoughts of mutual envy, hate and revenge.",1962-10-31,7.842,8.1,460
158,100,"Lock, Stock and Two Smoking Barrels",A card shark and his unwillingly-enlisted friends need to make a lot of cash quick after losing a sketchy poker match. To do this they decide to pull a heist on a small-time gang who happen to be operating out of the flat next door.,1999-03-05,7.545,8.1,3237
159,11645,Ran,"With Ran, legendary director Akira Kurosawa reimagines Shakespeare's King Lear as a singular historical epic set in sixteenth-century Japan. Majestic in scope, the film is Kurosawa's late-life masterpiece, a profound examination of the folly of war and the crumbling of one family under the weight of betrayal, greed, and the insatiable thirst for power.",1985-09-26,14.22,8.1,621
160,498249,Bad Seeds,"Wael, a former street child, makes a living from small scams with his adoptive mother and partner-in-crime Monique. When this unconventional duo swindles the wrong guy, Victor, an old acquaintance of Monique now in charge of a support organization for troubled teens, they have no choice but to become his interim secretary and educator in order to redeem themselves.",2018-11-21,8.031,8.1,256
161,11324,Shutter Island,"World War II soldier-turned-U.S. Marshal Teddy Daniels investigates the disappearance of a patient from a hospital for the criminally insane, but his efforts are compromised by his troubling visions and also by a mysterious doctor.",2010-02-18,21.028,8.1,13107
162,158445,Miracle in Cell No. 7,A story about a mentally ill man wrongfully accused of murder and his relationship with his lovingly adorable 6 year old daughter.,2013-01-23,8.54,8.1,167
163,857,Saving Private Ryan,"As U.S. troops storm the beaches of Normandy, three brothers lie dead on the battlefield, with a fourth trapped behind enemy lines. Ranger captain John Miller and seven men are tasked with penetrating German-held territory and bringing the boy home.",1998-07-24,29.034,8.1,8763
164,600,Full Metal Jacket,A pragmatic U.S. Marine observes the dehumanizing effects the U.S.-Vietnam War has on his fellow recruits from their brutal boot camp training to the bloody street fighting in Hue.,1987-06-26,16.449,8.1,5445
165,489,Good Will Hunting,"Will Hunting has a genius-level IQ but chooses to work as a janitor at MIT. When he solves a difficult graduate-level math problem, his talents are discovered by Professor Gerald Lambeau, who decides to help the misguided youth reach his potential. When Will is arrested for attacking a police officer, Professor Lambeau makes a deal to get leniency for him if he will get treatment from therapist Sean Maguire.",1997-12-05,15.837,8.1,6090
166,564427,Minha Vida em Marte,,2018-12-27,7.863,8.1,178
167,12445,Harry Potter and the Deathly Hallows: Part 2,"Harry, Ron and Hermione continue their quest to vanquish the evil Voldemort once and for all. Just as things begin to look hopeless for the young wizards, Harry discovers a trio of magical objects that endow him with powers to rival Voldemort's formidable skills.",2011-07-15,31.455,8.1,11988
168,92060,Michael Jackson's Thriller,A night at the movies turns into a nightmare when Michael and his date are attacked by a hoard of bloody-thirsty zombies.,1983-11-14,6.351,8.1,239
169,843,In the Mood for Love,"Taking place in Hong Kong of 1962, a melancholy story about the love between a woman and a man who live in the same building and one day find out that their husband and wife had an affair with each other.",2000-05-22,18.706,8.1,853
170,603,The Matrix,"Set in the 22nd century, The Matrix tells the story of a computer hacker who joins a group of underground insurgents fighting the vast and powerful computers who now rule the earth.",1999-03-30,50.289,8.1,14911
171,324786,Hacksaw Ridge,"WWII American Army Medic Desmond T. Doss, who served during the Battle of Okinawa, refuses to kill people and becomes the first Conscientious Objector in American history to receive the Congressional Medal of Honor.",2016-11-04,21.24,8.1,6855
172,11712,Sanjuro,"Toshiro Mifune swaggers and snarls to brilliant comic effect in Kurosawa's tightly paced, beautifully composed ""Sanjuro."" In this companion piece and sequel to ""Yojimbo,"" jaded samurai Sanjuro helps an idealistic group of young warriors weed out their clan's evil influences, and in the process turns their image of a proper samurai on its ear.",1963-05-07,8.674,8.1,214
173,7345,There Will Be Blood,"Ruthless silver miner, turned oil prospector, Daniel Plainview moves to oil-rich California. Using his adopted son to project a trustworthy, family-man image, Plainview cons local landowners into selling him their valuable properties for a pittance. However, local preacher Eli Sunday suspects Plainviews motives and intentions, starting a slow-burning feud that threatens both their lives.",2007-12-28,12.456,8.1,2989
174,11104,Chungking Express,"Two melancholy Hong Kong policemen fall in love: one with a mysterious female underworld figure, the other with a beautiful and ethereal server at a late-night restaurant he frequents.",1994-09-15,13.767,8.1,507
175,30588,Monsieur Verdoux,"The film is about an unemployed banker, Henri Verdoux, and his sociopathic methods of attaining income. While being both loyal and competent in his work, Verdoux has been laid-off. To make money for his wife and child, he marries wealthy widows and then murders them. His crime spree eventually works against him when two particular widows break his normal routine.",1947-04-11,6.776,8.1,156
176,46738,Incendies,"A mother's last wishes send twins Jeanne and Simon on a journey to Middle East in search of their tangled roots. Adapted from Wajdi Mouawad's acclaimed play, Incendies tells the powerful and moving tale of two young adults' voyage to the core of deep-rooted hatred, never-ending wars and enduring love.",2010-09-04,9.566,8.1,1062
177,11423,Memories of Murder,"1986 Gyunggi Province. The body of a young woman is found brutally raped and murdered. Two months later, a series of rapes and murders commences under similar circumstances. And in a country that had never known such crimes, the dark whispers about a serial murderer grow louder. A special task force is set up in the area, with two local detectives Park Doo-Man and Jo Young-Goo joined by a detective from Seoul who requested to be assigned to the case.",2003-04-24,15.484,8.1,927
178,491480,The Boy Who Harnessed the Wind,"Against all the odds, a thirteen year old boy in Malawi invents an unconventional way to save his family and village from famine.",2019-03-01,10.671,8.1,356
179,1394,Nostalgia,"The Russian poet Andrei Gorchakov, accompanied by guide and translator Eugenia, is traveling through Italy researching the life of an 18th-century Russian composer. In an ancient spa town, he meets the lunatic Domenico, who years earlier had imprisoned his own family in his house for seven years to save them from the evils of the world. Seeing some deep truth in Domenico's act, Andrei becomes drawn to him. In a series of dreams, the poet's nostalgia for his homeland and his longing for his wife, his ambivalent feelings for Eugenia and Italy, and his sense of kinship with Domenico become intertwined.",1983-10-05,8.448,8.1,196
180,160885,Tel chi el telùn,,2009-03-01,5.545,8.1,209
181,205596,The Imitation Game,"Based on the real life story of legendary cryptanalyst Alan Turing, the film portrays the nail-biting race against time by Turing and his brilliant team of code-breakers at Britain's top-secret Government Code and Cypher School at Bletchley Park, during the darkest days of World War II.",2014-12-19,27.493,8.1,10717
182,9277,The Sting,Set in the 1930s this intricate caper deals with an ambitious small-time crook and a veteran con man who seek revenge on a vicious crime lord who murdered one of their gang.,1973-12-25,14.246,8.1,1155
183,582,The Lives of Others,A tragic love story set in East Berlin with the backdrop of an undercover Stasi controlled culture. Stasi captain Wieler is ordered to follow author Dreyman and plunges deeper and deeper into his life until he reaches the threshold of doubting the system.,2006-06-06,9.315,8.1,1762
184,348,Alien,"During its return to the earth, commercial spaceship Nostromo intercepts a distress signal from a distant planet. When a three-member team of the crew discovers a chamber containing thousands of eggs on the planet, a creature inside one of the eggs attacks an explorer. The entire crew is unaware of the impending nightmare set to descend upon them when the alien parasite planted inside its unfortunate host is birthed.",1979-05-25,27.555,8.1,7824
185,15,Citizen Kane,"Newspaper magnate, Charles Foster Kane is taken from his mother as a boy and made the ward of a rich industrialist. As a result, every well-meaning, tyrannical or self-destructive move he makes for the rest of his life appears in some way to be a reaction to that deeply wounding event.",1941-05-01,13.888,8.1,2500
186,1092,The Third Man,"In postwar Vienna, Austria, Holly Martins, a writer of pulp Westerns, arrives penniless as a guest of his childhood chum Harry Lime, only to learn he has died. Martins develops a conspiracy theory after learning of a ""third man"" present at the time of Harry's death, running into interference from British officer Major Calloway, and falling head-over-heels for Harry's grief-stricken lover, Anna.",1950-02-02,13.23,8.1,814
187,38,Eternal Sunshine of the Spotless Mind,"Joel Barish, heartbroken that his girlfriend underwent a procedure to erase him from her memory, decides to do the same. However, as he watches his memories of her fade away, he realises that he still loves her, and may be too late to correct his mistake.",2004-03-19,18.331,8.1,7785
188,19426,Nights of Cabiria,"Rome, 1957. A woman, Cabiria, is robbed and left to drown by her boyfriend, Giorgio. Rescued, she resumes her life and tries her best to find happiness in a cynical world. Even when she thinks her struggles are over and she has found happiness and contentment, things may not be what they seem.",1957-12-31,6.93,8.1,255
189,1955,The Elephant Man,"A Victorian surgeon rescues a heavily disfigured man being mistreated by his ""owner"" as a side-show freak. Behind his monstrous façade, there is revealed a person of great intelligence and sensitivity. Based on the true story of Joseph Merrick (called John Merrick in the film), a severely deformed man in 19th century London.",1980-10-03,14.089,8.1,1552
190,1059,The Hidden Fortress,"Japanese peasants Matashichi and Tahei try and fail to make a profit from a tribal war. They find a man and woman whom they believe are simple tribe members hiding in a fortress. Although the peasants don't know that Rokurota is a general and Yuki is a princess, the peasants agree to accompany the pair to safety in return for gold. Along the way, the general must prove his expertise in battle while also hiding his identity.",1958-12-28,7.464,8.1,213
191,81481,Silenced,"Based on actual events that took place at Gwangju Inhwa School for the hearing-impaired, where young deaf students were the victims of repeated sexual assaults by faculty members over a period of five years in the early 2000s.",2011-09-22,9.24,8.1,157
192,140420,Paperman,An urban office worker finds that paper airplanes are instrumental in meeting a girl in ways he never expected.,2012-11-02,7.209,8.1,1147
193,18438,Castaway on the Moon,"Mr. Kim is jobless, lost in debt and has been dumped by his girlfriend. He decides to end it all by jumping into the Han River - only to find himself washed up on a small, mid-river island. He soon abandons thoughts of suicide or rescue and begins a new life as a castaway. His antics catch the attention of a young woman whose apartment overlooks the river. Her discovery changes both their lives.",2010-02-05,7.634,8.1,278
194,424694,Bohemian Rhapsody,"Singer Freddie Mercury, guitarist Brian May, drummer Roger Taylor and bass guitarist John Deacon take the music world by storm when they form the rock 'n' roll band Queen in 1970. Hit songs become instant classics. When Mercury's increasingly wild lifestyle starts to spiral out of control, Queen soon faces its greatest challenge yet – finding a way to keep the band together amid the success and excess.",2018-11-02,43.38,8.1,8380
195,310569,The Second Mother,"After leaving her daughter Jessica in a small town in Pernambuco to be raised by relatives, Val spends the next 13 years working as a nanny to Fabinho in São Paulo. She has financial stability but has to live with the guilt of having not raised Jessica herself. As Fabinho’s university entrance exams approach, Jessica reappears in her life and seems to want to give her mother a second chance. However Jessica has not been raised to be a servant and her very existence will turn Val’s routine on its head. With precision and humour, Anna Muylaert turns her eye on the subtle and powerful forces that keep rigid class structures in place and how the youth may just be the ones to shake it all up.",2015-08-28,9.142,8.1,367
196,387,Das Boot,"A German submarine hunts allied ships during the Second World War, but it soon becomes the hunted. The crew tries to survive below the surface, while stretching both the boat and themselves to their limits.",1982-02-10,13.125,8.1,1012
197,204,The Wages of Fear,"In the South American jungle, supplies of nitroglycerine are needed at a remote oil field. The oil company pays four men to deliver the supplies in two trucks. A tense rivalry develops between the two sets of drivers on the rough remote roads where the slightest jolt can result in death.",1955-02-16,9.795,8.1,335
198,32085,Vincent,Young Vincent Malloy dreams of being just like Vincent Price and loses himself in macabre daydreams that annoy his mother.,1982-01-01,6.88,8.1,458
199,821,Judgment at Nuremberg,"In 1947, four German judges who served on the bench during the Nazi regime face a military tribunal to answer charges of crimes against humanity. Chief Justice Haywood hears evidence and testimony not only from lead defendant Ernst Janning and his defense attorney Hans Rolfe, but also from the widow of a Nazi general, an idealistic U.S. Army captain and reluctant witness Irene Wallner.",1961-12-19,9.301,8.0,315
